,eid,doi,pii,pubmed_id,title,subtype,subtypeDescription,creator,afid,affilname,affiliation_city,affiliation_country,author_count,author_names,author_ids,author_afids,coverDate,coverDisplayDate,publicationName,issn,source_id,eIssn,aggregationType,volume,issueIdentifier,article_number,pageRange,description,authkeywords,citedby_count,openaccess,freetoread,freetoreadLabel,fund_acr,fund_no,fund_sponsor
63,2-s2.0-85180415473,10.3390/su152115387,,,Renewable Energy and Sustainable Development—Investigating Intention and Consumption among Low-Income Households in an Emerging Economy,ar,Article,Fazal S.A.,60212785;60090705;60027523,UKM-Graduate School of Business;Universiti Malaysia Kelantan;Daffodil International University,Bangi;Bachok;Dhaka,Malaysia;Malaysia;Bangladesh,3,"Fazal, Syed Ali;Hayat, Naeem;Al Mamun, Abdullah",57191227941;57209311348;36782596500,60027523;60090705;60212785,2023-11-01 00:00:00,November 2023,Sustainability (Switzerland),,21100240100,20711050,Journal,15,21,15387,,"To mitigate the harmful effects of climate change and progress toward achieving sustainable development goals, renewable energy sources should be available to low-income households. Households depend heavily on traditional energy sources. Therefore, this study aims to investigate the determinants that influence the intention and consumption of renewable energy among low-income households in Malaysia. Quantitative data was collected from 420 households through structured interviews. Analysis was conducted using SEM-PLS. The results revealed that perceived benefits and environmental concerns influence environmental attitudes. Motivation, skills, and knowledge affect subjective norms and perceived behavioral control, respectively. The study also found that attitude towards the environment and perceived behavioral control influence households’ intention towards renewable energy consumption and renewable energy consumption behavior. The results provided a clear idea of households’ intention in emerging economies towards renewable energy consumption to protect environmental damage from the harmful effects of the traditional use of energy sources. Therefore, policymakers in developing nations should focus on the feasibility of renewable energy projects and design group-agnostic campaigns for low-income households to ensure economic, social, and environmental sustainability through the mass adoption of renewable energy.",low-income households | renewable energy | rural Malaysia | sustainable development | theory of planned behavior,2,1,publisherfullgold,Gold,,undefined,
64,2-s2.0-85176372263,10.3390/en16217407,,,Economic Analysis of Large-Scale Renewable Energy (RE) Source Investment Incorporating Power System Transmission Costs,ar,Article,Lee D.,60005273,Korea University,Seoul,South Korea,2,"Lee, Deukyoung;Joo, Sung Kwan",57222404330;15044801000,60005273;60005273,2023-11-01 00:00:00,November 2023,Energies,,62932,19961073,Journal,16,21,7407,,"Recently, the proportion of renewable energy (RE) sources in a power system has been increasing worldwide to reduce carbon emissions. To effectively accommodate renewable energy, there is a growing need to develop integrated planning strategies for both renewable energy sources and transmission lines in a power system, taking into account the location-specific characteristics of renewable energy. Economically viable and rapid system expansion plans are required to resolve the problem of delayed integration of renewable energy into existing power system, which arises due to inadequate transmission facilities. To address these problems, this paper presents an integrated economic evaluation method that considers the inherently uncertain output characteristics of renewable energy, contingent on location, the costs associated with installing transmission lines, and environmental benefits. The case study is conducted using a modified power system in Korea. In the case study, it is assumed that by integrating solar power generators in a low-demand area and wind power generators in a high-demand area, wind power plants have higher construction costs than solar power generators. However, the transmission costs for wind power plants are lower than those for solar power generators due to the regional characteristics of the power grid in the installation areas because renewable energy in high-demand areas typically requires less additional power infrastructure than in low-demand areas. The results of this study show that the net benefit for the wind power plant is estimated at USD 225.4 M, while the solar power plant yields a net benefit of USD 22.9 M in the example system. These results demonstrate the effectiveness of the proposed method, underscoring its potential to mitigate the challenges faced in the practical implementation of renewable energy projects.",energy transition | renewable energy | renewable energy development | renewable energy sources | sustainable energy,2,1,publisherfullgold,Gold,MOTIE,20204010600220,"Ministry of Trade, Industry and Energy"
65,2-s2.0-85175020939,10.3390/computation11100199,,,Spillover Effects of Green Finance on Attaining Sustainable Development: Spatial Durbin Model,ar,Article,Kwilinski A.,60177669;60107816;60016511,"London Academy of Science and Business;WSB University, Dabrowa Gornicza;Sumy State University",London;Dabrowa Gornicza;Sumy,United Kingdom;Poland;Ukraine,3,"Kwilinski, Aleksy;Lyulyov, Oleksii;Pimonenko, Tetyana",57204068618;56809418500;56274453800,60107816-60177669-60016511;60107816-60016511;60107816-60016511,2023-10-01 00:00:00,October 2023,Computation,,21100857172,20793197,Journal,11,10,199,,"Attaining sustainable development goals is a complex process that involves a range of economic, social, and environmental factors. It requires investments in infrastructure, technology, and human capital. In this case, green finance is conducive to channel investments toward sustainable projects and initiatives by providing incentives for environmentally friendly practices and technologies and by encouraging companies and investors to adopt sustainable business models. This paper aims to check the spatial spillover effect of green finance on attaining sustainable development for European Union (EU) countries for 2008–2021. The study applies the spatial Durbin model to explore the research hypothesis. The findings confirm that green finance promotes the achievement of sustainable development goals. However, the impact of green finance on attaining sustainable development is heterogeneous depending on the EU region. In this case, the EU should intensify its green finance policy considering the regional features that significantly affect the achievement of sustainable development goals by reducing greenhouse gas emissions, improving energy efficiency, and promoting renewable energy. In addition, it is necessary to develop alternative financial sources involving green bonds that could be used to fund green projects on renewable energy projects, green building construction, etc.",environmental expenditure | green growth | green investment | inclusive development,24,1,publisherfullgold,Gold,MESU,0121U100468,Ministry of Education and Science of Ukraine
69,2-s2.0-85174896934,10.1016/j.biombioe.2023.106916,S0961953423002155,,Towards renewable energy projects under sustainable watersheds principles for forest biomass supply,ar,Article,França L.C.d.J.,60103782;60017841;60015104,Universidade Federal dos Vales do Jequitinhonha e Mucuri;Universidade Federal de Lavras;Universidade Federal de Uberlândia,Diamantina;Lavras;Uberlandia,Brazil;Brazil;Brazil,5,"França, Luciano Cavalcante de Jesus;Jarochinski e Silva, Carolina Souza;Mucida, Danielle Piuzana;Severino da Costa, Jaqueline;Gomide, Lucas Rezende",57191983454;25923113200;57819526600;58664849600;35388208600,60015104;60017841;60103782;60017841;60017841,2023-09-01 00:00:00,September 2023,Biomass and Bioenergy,09619534,28810,18732909,Journal,176,,106916,,"The transition in the global energy matrix to sources of renewable electric generation has been the main demand of countries in the face of a state of climatic emergency. Forest biomass is a potential alternative to meet the growing demand. The expansion of thermoelectric projects based on forest residues highlights the need to assess raw materials' availability and land suitability. This is usually a problem of spatial decision and geographic intelligence under a holistic perspective since, in planning these projects, it is essential to understand the economic, environmental, and social feasibility. In this article, we propose a decision support system based on multi-criteria modeling on a GIS structure associated with a mathematical optimization model for zoning the suitability and availability of land for constructing thermoelectric power plants. The geospatial model for determining priority sites integrated various environmental, social, and economic criteria and constraints. The AHP method was used to weigh and estimate the relative importance weights of the criteria for modeling territorial aptitude. The results of the GIS stage formed the basis of a mixed-integer linear programming model that incorporated technical and economic aspects for a better allocation of financial resources. The minimized cost function included transport costs, harvesting, forestry, purchasing land/leasing land/forest outgrower schemes, and purchasing wood from the market to supply the biomass. We used a sizeable hydrographic basin in southeastern Brazil as a case study for the demonstration. The mapping of suitability and constrained zones identified the classes of preference and availability of land. The proposed mathematical model recognized sets of supply locations (new plantations or existing areas) and minimized the project's final cost to supply biomass to meet the demand of potential thermoelectric plants that are candidates for implementation. Despite the problem's large scale and the large data set, our findings indicated that we could provide a broad and multidimensional view of the potential of developing electrical generation systems based on forest biomass. The methodology and the model proposed in this study can be replicated in other global regions and modified to assess other resources from different biomasses and bioenergy systems. Our study promotes the UN's sustainable development goals, particularly SDG 7 (Affordable and clean energy) and SDG 13 (Climate Action).",Bioeconomy | Forest planning | Green industry | Land-use planning | Mixed-integer linear programming | Multi-criteria decision analysis,1,1,publisherfree2read,Bronze,CAPES,001,Coordenação de Aperfeiçoamento de Pessoal de Nível Superior
73,2-s2.0-85144205578,10.1002/gj.4654,,,"Role of sustainable finance, geopolitical risk and economic growth in renewable energy investment: Empirical evidence from China",ar,Article,Lin Z.,60105146;60072902;60006793,Princess Nourah Bint Abdulrahman University;Macau University of Science and Technology;Universidad de Oviedo,Riyadh;Taipa;Oviedo,Saudi Arabia;Macao;Spain,4,"Lin, Zhou;Alvarez-Otero, Susana;Belgacem, Samira Ben;Fu, Qinghua",58020215500;35881422100;57225070164;57209028341,60072902;60006793;60105146;,2023-09-01 00:00:00,September 2023,Geological Journal,00721050,26474,10991034,Journal,58,9,,3339-3347,"The global economic recession caused by COVID-19 has posed a severe threat to the feasibility of renewable energy projects, hampering the United Nation (UN) sustainable development goals. Sustainable financing (SF) is a crucial instrument for promoting investment in renewable energy (IRE) sources, as it is regarded as a crucial aspect in achieving long-term sustainability. This study sheds insight on the impact of SF, geopolitical risk (GPR), economic growth (EG), and environmental regulation (ER) on IRE sources by evaluating 10 years of data from 35 Chinese energy businesses from 2012 to 2021. The data analysis is done by utilizing quantile regression and dynamic analytic techniques, demonstrating that SF, EG, and ER have a significant positive effect on IRE sources. However, GPR has a significant detrimental impact on IRE in China. This is one of the early studies to examine the crucial role of SF, GPR, EG, and ER in IRE, which is critical for environmental sustainability. In addition, it provides policymakers and environmentalists with crucial insights for developing and executing environmental strategies that can deliver long-term benefits and meet SD goals.",economic growth | environmental regulation | geopolitical risk | renewable energy | sustainable finance,8,0,,,,undefined,
77,2-s2.0-85169154035,10.3390/su151612316,,,A Strategic Analysis of Photovoltaic Energy Projects: The Case Study of Spain,ar,Article,Segura E.,60028442;60000823,Universidad Politécnica de Madrid;Universidad de Castilla-La Mancha,Madrid;Ciudad Real,Spain;Spain,4,"Segura, Eva;Belmonte, Lidia M.;Morales, Rafael;Somolinos, José A.",56927915300;56728280100;57160596600;6601955347,60000823;60000823;60000823;60028442,2023-08-01 00:00:00,August 2023,Sustainability (Switzerland),,21100240100,20711050,Journal,15,16,12316,,"The Spanish photovoltaic sector could be a serious opportunity for the recovery and economic growth of the country, by serving as a support platform for the National Integrated Energy and Climate Plan (NIECP) 2021–2030, whose objective is to determine the lines of action required for the appropriate and efficient use of clean energy in order to benefit the economy, employment, health, and the environment. Bearing in mind the notable increase in the economic competitiveness of photovoltaic energy in Spain when compared to traditional and other renewable energy sources, it is necessary to carry out a strategic analysis of the macro-environment, using a PESTEL (Political, Economical, Social, Technological, Environmental and Legal) analysis so as to identify the most relevant external aspects that are vital for the performance of photovoltaic industries/markets and to facilitate decision making when developing short-, medium-, and long-term strategies, and the micro-environment, using Porter’s five forces (threat of new entrants, threat from substitution products and/or services, the bargain power of suppliers, the bargaining power of buyers and competitive rivalry) framework, to determine and examine the main factors that define the structure and level of competition that exists within the Spanish industry/market. The results obtained have been combined in a SWOT (Strengths, Weaknesses, Opportunities, and Threats) chart, which facilitates an understanding of the current strengths, weaknesses, opportunities, and threats as regards the photovoltaic sector in Spain.",PESTEL analysis | photovoltaic solar energy | Porter’s five forces | renewable energy | SWOT analysis,3,1,publisherfullgold,Gold,MICINN,E-13-2022-0102052,Ministerio de Ciencia e Innovación
78,2-s2.0-85167901855,10.3390/su151511869,,,The Renewable Energy Communities in Italy and the Role of Public Administrations: The Experience of the Municipality of Assisi between Challenges and Opportunities,ar,Article,Moretti E.,60003003,Università degli Studi di Perugia,Perugia,Italy,2,"Moretti, Elisa;Stamponi, Ettore",37261845000;57220087708,60003003;60003003,2023-08-01 00:00:00,August 2023,Sustainability (Switzerland),,21100240100,20711050,Journal,15,15,11869,,"The pressing necessity to address climate change calls for the reduction in carbon emissions in the energy sector. Renewable energy communities (RECs) provide environmental, financial, and societal advantages that facilitate the shift towards sustainable energy sources. This paper examines the development of RECs in Italy through a case study in the Municipality of Assisi, and investigates the pivotal role played by public administrations as catalysts in the formation of RECs. Despite facing unique challenges and constraints, Assisi leverages RECs and the proactive approach of the local government to overcome barriers hindering the implementation of renewable energy projects. A municipality-led REC of a total power of 2 MWp by 2030, using clusters of prosumers and consumers and including energy-intensive municipal facilities, is investigated. Through rigorous simulations and the resulting shared energy, the study conducts a comprehensive analysis encompassing technical, energy, and economic aspects. The results, including relevant energy indices, are presented and various scenarios are discussed as the energy shared varies. Finally, sensitivity analyses show that the profitability strongly depends on the cost of energy, the remuneration from the sale, and the value of the incentive earned on the shared energy: the simple payback time ranges from 8 to 14 years and NPV varies from EUR 0.8 to 4.5 M.",economic analysis | energy community | energy transition | Italian regulatory framework | public administrations (PAs) | renewable energy communities (RECs),3,1,publisherfullgold,Gold,EC,2021-203,European Commission
80,2-s2.0-85154055197,10.1016/j.renene.2023.04.031,S0960148123004810,,Determinants of Project Finance success for renewable energy,ar,Article,Benavides-Franco J.,60104957;60007966,Universidad Icesi;Tecnológico de Monterrey,Cali;Monterrey,Colombia;Mexico,3,"Benavides-Franco, Julián;Gómez, Juan M.;Pérez-Uribe, Miguel A.",55601862300;57204630846;57223844117,60104957;60104957;60007966,2023-07-01 00:00:00,July 2023,Renewable Energy,09601481,27569,18790682,Journal,211,,,188-201,"World electricity consumption has grown permanently since 1990, dramatically increasing the emission of greenhouse gases. The worldwide efforts to reduce them and address climate change are leading to the massive electrification of different end-users, increasing the power demand. Therefore, achieving Sustainable Development Goals regarding affordable and clean energy requires the extensive availability of capital investments in electricity generation from renewable sources. Project Finance (PF) is a suitable financing alternative for large projects. This paper presents the advantages of PF contracts in allocating risks to appropriate counterparts and reducing the likelihood of default. Additionally, this study analyzes the characteristics that favor PF financing for renewable energy projects. The results reveal that country's governance levels, well-developed financial systems, and project costs affect the financing probability of a PF initiative, particularly for low and middle-income countries. Therefore, public policies aimed at increasing the availability of resources to renewable projects must tackle these factors.",Financial systems | Governance levels | Project finance | Renewable energy | Sustainable development goals,4,0,,,WBG,undefined,World Bank Group
83,2-s2.0-85153848282,10.1016/j.erss.2023.103089,S2214629623001494,,"Does renewable energy affect violent conflict? Exploring social opposition and injustice in the struggle over the Lake Turkana Wind Farm, Kenya",ar,Article,Lomax J.,60011520;120444301,King's College London;Independent Researcher,London;Leyland,United Kingdom;United Kingdom,3,"Lomax, Jake;Mirumachi, Naho;Hautsch, Marine",58459956000;24376673600;58202031000,120444301;60011520;60011520,2023-06-01 00:00:00,June 2023,Energy Research and Social Science,22146296,21100325067,,Journal,100,,103089,,"Renewable energy projects offer prospects for sustainable development and meeting climate goals. However, new renewable energy projects, often driven by donor aid and foreign direct investment, have triggered several challenges, notably those related to conflicts. Struggles over renewable energy projects demonstrate a range of social opposition and injustice that needs to be better understood. This study applies a conflict sensitivity framework to examine how changes in energy systems alter conflict. Using the case study of the Lake Turkana Wind Farm (LTWF) and secondary sources, the study analyses the range of conflict mechanisms identified by project implementers, as well as independent analysts. Conflict mechanisms reveal how energy system changes may affect violence in the project area, as well as the kinds of socio-economic consequences of conflict generated by LTWF. The paper critically examines the discrepancies between the project developer, Lake Turkana Wind Power, and analysts of independent studies in how conflict mechanisms are attributed to pathways of increasing or reducing conflict. The paper finds that the project developer evaluates its impact on conflict in a minimal way, making conflict sensitivity limited. The paper extends examination beyond inequalities in project outcomes and indicates a way to understand conflict sensitivity throughout the energy system.",Conflict | Conflict sensitivity | Foreign direct investment | Kenya | Lake Turkana Wind Power project | Renewable energy | Wind power,3,1,repositoryvor,Green,,2017–01941,
87,2-s2.0-85156138329,10.3390/en16083476,,,Assessment of Power System Asset Dispatch under Different Local Energy Community Business Models,ar,Article,Korõtko T.,60071050;60068861;60005141,Institute of Physical Energetics Latvian Academy of Sciences;Tallinna Tehnikaülikool;University College Dublin,Riga;Tallinn;Dublin,Latvia;Estonia;Ireland,8,"Korõtko, Tarmo;Plaum, Freddy;Häring, Tobias;Mutule, Anna;Lazdins, Roberts;Borščevskis, Olegs;Rosin, Argo;Carroll, Paula",55948587900;57218934946;57211512274;24438194800;57218902151;35423567200;24081367900;52463236300,60071050-60068861;60068861;60068861;60071050;60071050;60071050;60068861;60005141,2023-04-01 00:00:00,April 2023,Energies,,62932,19961073,Journal,16,8,3476,,"Community energy projects have gained popularity in recent years, and encouraging citizens to form local energy communities (LEC) is considered an effective tool for raising awareness about renewable energy. Since no single universal method exists for operating LECs, this study investigated the impact that different business models and asset dispatch methods have on LECs’ economic and energy-related indicators. We carried out a case study, which included the development, modelling, and simulation of seven scenarios using mixed-integer linear programming (MILP). To measure and compare the prospective performance of the LECs in each scenario, six key metrics were evaluated and assessed. The authors find that simple, rule-based control systems might be well suited for LECs with a limited number of controllable assets that aim to provide increased levels of self-consumption of up to 3%. We also conclude that when the LEC utilises an energy cooperative business model, the selected asset dispatch method provides only minor differences in LEC performance, while for prosumer communities, the importance of selecting a suitable asset dispatch method is higher. We also conclude that LECs have the potential to significantly increase their economic performance by more than 10% by acting as aggregators and providing grid services directly to system operators.",asset dispatch | battery energy storage | energy management | local energy community | optimisation | power system flexibility | renewable energy sources,3,1,publisherfullgold,Gold,EC,856602,European Commission
95,2-s2.0-85148748853,10.3390/laws12010013,,,"Regulation of Incentives for Use of Renewable Energy at the Level of Regional Legislation in Federal States, Using the Russian Federation as an Example",ar,Article,Kirichenko A.,60020189;60005163,Kuban State University;Kuban State Agrarian University,Krasnodar;Krasnodar,Russian Federation;Russian Federation,3,"Kirichenko, Anna;Kirichenko, Ksenia;Kirichenko, Evgeniy",57217585508;54391689400;57214753387,60005163;60020189;60005163,2023-02-01 00:00:00,February 2023,Laws,,21101087784,2075471X,Journal,12,1,13,,"Effective use of renewable energy requires a system of energy legislation that meets modern challenges. Although, in large countries, climate and socioeconomic factors in different regions can significantly vary and can affect the regional legislation regulating renewable energy sources, careful reproduction of good practices and successful experiences of other regions are a good basis for the development of legislation. The comparative method of legal research was the main method used to achieve the objectives set in this study. Based on the results, a number of recommendations were developed to consolidate and expand the powers of regional regulators in the field of renewable energy, to include an economic assessment of the effectiveness of state programs, to use tax incentives for renewable energy projects, and to introduce restrictions on the use of petroleum products. Recommendations were also made to improve regional legislation on renewable energy sources in terms of legal techniques. Further development of this study would contribute to the improvement of regional legal regulation and would accelerate the transition to “green” energy.",energy law | environmental law | lawmaking | national legislation | regional legislation | renewable energy source,0,1,publisherfullgold,Gold,RSF,22-28-20298,Kuban Science Foundation
