,eid,doi,pii,pubmed_id,title,subtype,subtypeDescription,creator,afid,affilname,affiliation_city,affiliation_country,author_count,author_names,author_ids,author_afids,coverDate,coverDisplayDate,publicationName,issn,source_id,eIssn,aggregationType,volume,issueIdentifier,article_number,pageRange,description,authkeywords,citedby_count,openaccess,freetoread,freetoreadLabel,fund_acr,fund_no,fund_sponsor
91,2-s2.0-85141386944,10.2495/EQ-V7-N3-226-244,,,ECONOMIC EFFICIENCY OF RUSSIAN RENEWABLE ENERGY PROJECTS IN THE CONTEXT OF STATE SUPPORT OF THE SECTOR,ar,Article,Chebotareva G.S.,60120928,Academic Department of Economics of Industrial and Energy Systems,Yekaterinburg,Russian Federation,1,"Chebotareva, Galina S.",56105454200,60120928,2022-09-06 00:00:00,6 September 2022,International Journal of Energy Production and Management,20563272,21100903414,20563280,Journal,7,3,,226-244,"A current global trend in the development of renewable energy (RES) is the phasing out of state support and the transition of this sector to an exclusively competitive market. The question however is, when, among other things, it would be possible for such projects to achieve self-sufficiency. Therefore, the main goal of this work is to study the economic efficiency of Russian RES projects as a prospect for their functioning outside of state support programs. Fifty-two solar, wind, and hydropower projects, which have received support in the form of a capacity-based support scheme in 2018–2020, were selected as the objects of research. The methodological basis of this work is the classical method of investment analysis, supplemented by an industry-specific approach. The efficiency assessment was carried out for the 15-year period of projects’ state support, as well as for the entire designed operation period of power plants. The dependence of the projects’ economic effect on a combination of factors, including the type of project, the commissioning period, regional affiliation, capital expenditures, etc., were studied. Based on the results of the analysis, the conclusions about the current unpreparedness of the Russian RES sector to operate in a competitive market were substantiated; proposals for the development of programs to support the sector were formulated. A unique factor that has a significant impact on the achievement of a positive economic effect by such projects – the value of specific capital expenditures – was identified. The obtained research results are of practical and methodological significance. They will be used in the development of a methodological approach to assess the effectiveness of the rejection by the Russian RES market of state support tools at certain stages of the projects.",capacity-based support scheme | capital expenditures economic efficiency | energy market | hydroelectric power | investment analysis | renewable energy | solar power | state support | wind power,2,1,publisherfree2read,Bronze,,MK-4549.2021.2,Council on grants of the President of the Russian Federation
92,2-s2.0-85142852270,10.24850/j-tyca-13-05-08,,,Theoretical assessment of the available power from the marine energy sources in Mexico,ar,Article,García-Santiago E.I.,60032442,Universidad Nacional Autónoma de México,Mexico,Mexico,3,"García-Santiago, Erick Iván;Mendoza, Edgar;Silva, Rodolfo",57984314700;55702520934;55993636000,60032442;60032442;60032442,2022-09-01 00:00:00,September 2022,Tecnologia y Ciencias del Agua,01878336,20500195022,20072422,Journal,13,5,,287-325,"While the need to use clean, renewable energies in electricity generation is universally understood, Mexico is lagging behind other countries regarding the contribution these sources have to the production of energy nationally. The first hurdle to overcome is providing accurat e information for decision-makers and potential investors. In the case of renewable marine energy, this means generating data on the possible installed electrical capacities of the various sources at sites across the country. From this, it is possible to estimate the economic viability of implementing renewable energy projects at specific locations. This work, therefore, aims to characterize the available power from diverse energy sources around the coasts of Mexico and to make recommendations of sites where the energy potential warrants further analysis. A literature review of the power available from marine currents, waves, and thermal and saline gradient sources was performed for the Mexican Caribbean. Several sites were found to be geographically viable; there is sufficient potential energy available to meet at least part of the energy demands of the Yucatan Peninsula and Cozumel Island. Key sites are to the south of Cozumel Island and in the Cozumel Channel for energy harvested from ocean currents. In the northern part of Quintana Roo, sites offer great potential for wave energy, while the central part of the state could be suitable for energy generation from thermal gradients. In Chetumal Bay, there is potential for saline gradient electricity. Wave energy potential was evaluated for the entire Mexican coast, and seven locations are recommended for further investigation. A conservative gross estimation has shown that wave energy could contribute up to 0.2 % of the national demand in the short or mid-term, with a relatively small investment and a low environmental impact.",available ocean power | Marine energy | marine plants deployment locations | renewable sources installed capacity,1,1,publisherfullgold,Gold,,undefined,
93,2-s2.0-85139867283,10.1063/5.0093425,,,Risk evaluation of energy investment projects along the Belt and Road based on cloud model and evidence theory,ar,Article,Ge J.,60064143;60028785,Nanjing University of Information Science &amp; Technology;The University of North Carolina at Pembroke,Nanjing;Pembroke,China;United States,4,"Ge, Jiaojiao;Wan, Anxia;Peng, Benhong;Wei, Guo",57363171600;57218163506;57190340388;57217523709,60064143;60064143;60064143;60028785,2022-09-01 00:00:00,1 September 2022,Journal of Renewable and Sustainable Energy,,19700194012,19417012,Journal,14,5,055903,,"China's major energy projects along the Belt and Road are characterized by large-scale capital investment, long construction cycles, and complex investment environments, making it more difficult to assess project investment risks. Based on the PESTEL theory, a risk evaluation index system is constructed for energy enterprises' investment projects along the Belt and Road. In view of the uncertainty of energy investment projects, a risk evaluation method combining a cloud model and an evidence theory is proposed. To examine the developed index system and risk evaluation method, an overseas hydropower investment project is chosen and the risk factors are analyzed. The results suggest that the risk level of the enterprise's project is highest, the political and environmental risks are both high, the economic and project risks are both at average level, and the energy risk is relatively low, which verifies the effectiveness of this information fusion method. The method can be used to solve the problem of linguistic ambiguity and uncertainty in multi-attribute decision problems and is applicable to similar investment projects, thus providing a new technical path to assess the investment risks of energy enterprises along the Belt and Road.",,0,0,,,,KYCX22_1245,
94,2-s2.0-85138332074,10.3390/ijerph191811716,,36141989,Screening of Factors for Assessing the Environmental and Economic Efficiency of Investment Projects in the Energy Sector,ar,Article,Karaeva A.P.,60103702;60015877,Uralʹskiĭ Federalʹnyĭ Universitet;Universitatea Lucian Blaga din Sibiu,Yekaterinburg;Sibiu,Russian Federation;Romania,4,"Karaeva, Anzhelika Pirmamedovna;Magaril, Elena Romenovna;Kiselev, Andrey Vladimirovich;Cioca, Lucian Ionel",57192875545;57198456177;57205413665;15077890400,60103702;60103702;60103702;60015877,2022-09-01 00:00:00,September 2022,International Journal of Environmental Research and Public Health,16617827,144989,16604601,Journal,19,18,11716,,"In view of the current agenda in the field of climate and environmental conservation, the requirements for environmental project appraisal are being tightened: the evaluation of environmental indicators of project implementation should be carried out on a par with indicators of its economic performance. Current approaches to the assessment of environmental and economic efficiency do not completely cover the negative environmental impacts of a project’s implementation, and this reduces the effectiveness of the evaluation. Therefore, it is necessary to develop a system of environmental indicators that will address the specifics of the industry. This is made possible on the basis of determining a list of key factors that should be included in the evaluation system. The purpose of this study is to determine the most significant factors for establishing a simple yet thorough assessment framework to evaluate the efficiency of energy investment projects. Research methodology includes an a priori ranking method and analysis of interrelations between factors. Based on the results obtained, the authors have formed a list of key factors that could become the basis of a future system of environmental indicators for the efficiency assessment of energy projects.",eco-modernization | efficiency assessment | energy sector | fossil fuels,8,1,repositoryvor,Green,RSF,22-28-01740,Russian Science Foundation
96,2-s2.0-85133852393,10.1016/j.accre.2022.06.004,S1674927822000661,,Climate pledges versus commitment: Are policy actions of Middle-East and North African countries consistent with their emissions targets?,ar,Article,Abudu H.,60018205,Xiamen University,Xiamen,China,3,"Abudu, Hermas;Wesseh, Presley K.;Lin, Boqiang",57209715582;55337880800;35098935000,60018205;60018205;60018205,2022-08-01 00:00:00,August 2022,Advances in Climate Change Research,16749278,21100310030,,Journal,13,4,,612-621,"Carbon emission is inevitable, and changes with energy consumption and economic development, presents policy options toward sustainable development path. Currently, there is little assurance from policymakers in committing to climate change pledges: taking the Middle-East and North African (MENA) region as a specific case with using 2019 as a cut-off period. We conducted an interim assessment of the Paris Agreement to ascertain whether climate actions are in tandem with emissions reduction targets. Making use of difference-in-difference technique as a quasi-experiment supported by fixed-effects and placebo treatment models, the results point to evidence of less than 1% effective CO2 emissions reduction as of 2019 compared to the 2015 level. The current carbon emissions reduction commitment level is far-reaching contrary to the Nationally Determined Contributions (NDCs) pledged (16.43% on average by 2030 compared to the 2015 level). The analysis suggests that achieving NDCs commitments are currently major burden on policymakers since the economic development is highly linked with nonrenewable energy consumption. Furthermore, a more comprehensive framework when accounting for all available renewable and clean energy projects shows reduction levels in the range of 30%–40% from 2020 to 2030. These results suggest that the Paris Agreement in MENA countries may be more effective from 2020, thus underscore the importance of capturing ongoing projects (involving renewable and clean energy technologies) into interim policy assessment. The shared implication is that greater efforts are demanded from the region and at country levels to further decrease emissions through the use of negative emissions technologies particularly in the electricity generation sector.",Carbon efficiency | Carbon emissions reduction potential | Climate change policy quasi-experiment | MENA climate change performance | Paris Agreement,9,1,publisherfullgold,Gold,NSFC,72133003,National Natural Science Foundation of China
98,2-s2.0-85130321688,10.1016/j.eneco.2022.106065,S0140988322002316,,Financing national scale energy projects in developing countries – An economy-wide evaluation of Ghana's Bui Dam,ar,Article,Nechifor V.,60172346;60103695;60071877;60022148,School of Engineering;European Commission Joint Research Centre;CSIR - Water Research Institute Ghana;University College London,Manchester;Brussels;Accra;London,United Kingdom;Belgium;Ghana;United Kingdom,5,"Nechifor, Victor;Basheer, Mohammed;Calzadilla, Alvaro;Obuobie, Emmanuel;Harou, Julien J.",57194727077;57189254083;6506024121;52264231000;24329473000,60103695-60022148;60172346;60022148;60071877;60172346-60022148,2022-07-01 00:00:00,July 2022,Energy Economics,01409883,29374,,Journal,111,,106065,,"Large energy infrastructure can imply special financing arrangements between governments in developing economies and investors or lenders. These arrangements can lead to economy-wide and sector-specific impacts which need to be considered in the project economic evaluation. By considering the case of the Bui Dam in Ghana, we use a macroeconomic approach to determine how the economic performance of critical energy infrastructure manifests during the construction, financing and operation phases. The analysis uses an integrated modelling framework that combines a Computable General Equilibrium (CGE) model of Ghana with a water balance model of the Lower Volta River Basin. The results highlight the importance of including indirect and induced effects, in addition to the direct effects from project operation, as they influence the scale and temporal evolution of the economic impacts. The collateral from the infrastructure loan agreement consisting in cocoa exports to China nearly doubles the project's positive GDP impact and has a significant multiplier effect over urban and rural household income compared to a standard commercial loan. We finish with a discussion of how the proposed investment-oriented modelling framework can contribute to ex-ante strategic assessments of proposed energy infrastructure in developing countries.",Computable general equilibrium | Developing countries | Energy infrastructure development | Hydrological uncertainty | Project finance | Water balance model,4,1,repositoryam,Green,FSE,ES/P011373/1,"Faculty of Science and Engineering, University of Manchester"
100,2-s2.0-85126357658,10.1016/j.rser.2022.112307,S1364032122002234,,Beyond LCOE: A multi-criteria evaluation framework for offshore renewable energy projects,ar,Article,Vanegas-Cantarero M.M.,60027272;126319463,The University of Edinburgh;CORPOWER OCEAN AB,Edinburgh;Stockholm,United Kingdom;Sweden,5,"Vanegas-Cantarero, María M.;Pennock, Shona;Bloise-Thomaz, Tianna;Jeffrey, Henry;Dickson, Matthew J.",57202497535;56572454100;57488621000;22834920700;57488508500,60027272;60027272;60027272;60027272;126319463,2022-06-01 00:00:00,June 2022,Renewable and Sustainable Energy Reviews,13640321,27567,18790690,Journal,161,,112307,,"The transition to low-carbon energy systems is a complex process that implies radical technological changes, greenhouse gas emission reductions, and benefits to the local economies yet, also significant investment, a need for capacity building, strengthening supply chains and supporting legal frameworks. Consequently, the choice of renewable energy technologies should be based on a comprehensive assessment addressing the different dimensions that are affected. Clean energy technologies are traditionally evaluated on the basis of their techno-economic performance. Such an approach penalises emerging energy technologies that are generally more capital-intensive given their innovation requirement and the lack of support mechanisms facilitating their industrial roll-out. In this paper, a multi-criteria evaluation framework is proposed encompassing three important broad dimensions: techno-economics, environment and socio-economics. The applicability and flexibility of the proposed evaluation framework are demonstrated on different case studies. First, the hypothetical deployment of a floating offshore wind farm both in Scotland and Portugal is evaluated. Later, the proposed framework is used to evaluate the deployments of wave energy devices in the same two locations. The results show that this multi-criteria approach provides a more holistic overview of the performance and implications of renewable energy technologies, particularly emerging ones, and can better support decision- and policy-making in the medium- and long-term. Furthermore, the framework can be used by researchers, investors, developers and/or analysts to assess energy planning alternatives.",Input–output analysis | Levelised cost of energy | Lifecycle Assessment | Multi-criteria evaluation | Offshore renewable energy,19,1,repositoryam,Green,H2020,731200,Horizon 2020 Framework Programme
101,2-s2.0-85130139723,10.3390/su14095588,,,Risk Perception Thresholds and Their Impact on the Behavior of Nearby Residents in Waste to Energy Project Conflict: An Evolutionary Game Analysis,ar,Article,Quan X.,60030034;60017060,Beijing Foreign Studies University;Central South University,Beijing;Changsha,China;China,3,"Quan, Xiongwei;Zuo, Gaoshan;Sun, Helin",57550248800;16240268900;57212341300,60017060;60030034;60017060,2022-05-01 00:00:00,May-1 2022,Sustainability (Switzerland),,21100240100,20711050,Journal,14,9,5588,,"In China, waste to energy (WTE) projects are currently considered the best choice for dealing with municipal solid waste (MSW), but their siting often leads to conflicts. The perceptions of proximate residents to the changes and uncertainty induced by WTE projects are the main reasons for such conflicts. Determining the indicators used to measure these changes is crucial for an evaluation of surrounding residents’ risk perception. One indicator is residents’ risk perception thresholds. Our paper employs evolutionary game theory to deduce the risk perception threshold of surrounding residents related to a WTE project, which provides a novel contribution to the literature. The results of a case study and simulations show that the level of the risk perception threshold has a crucial effect on the behavior choices of surrounding residents. Two important parameters that affect the value of this risk perception threshold are possible economic compensation and possible resistance costs. A change to the values of these two parameters can change the value of the risk perception threshold of nearby residents. If the change in the risk perceived by surrounding residents is lower than the threshold they can tolerate, they will accept construction of the project. However, if surrounding residents are worried about this risk fluctuating as a result of construction of the plant, they will behave more cautiously and conservatively, and if the possible risk exceeds the threshold that they are willing to tolerate, then they will boycott the plan and protest against the construction of the project. In this case, the surrounding residents will still show restraint. This study tries to provide a theoretical and practical basis for effective resolution by government of the public’s risk concerns and existing or imminent conflicts.",evolutionary game | risk perception | threshold | waste to energy project,1,1,publisherfullgold,Gold,NSFC,71573280,National Natural Science Foundation of China
105,2-s2.0-85126997073,10.1016/j.ecmx.2022.100204,S2590174522000277,,"The potential of energy recovery from municipal solid waste in Kampala City, Uganda by incineration",ar,Article,Amulen J.,60120545;60071676,Busitema University;Makerere University,Tororo;Kampala,Uganda;Uganda,4,"Amulen, Judith;Kasedde, Hillary;Serugunda, Jonathan;Lwanyaga, Joseph D.",57547757400;55985815000;56022846700;57205393885,60071676;60071676;60071676;60120545,2022-05-01 00:00:00,May 2022,Energy Conversion and Management: X,,21100896269,25901745,Journal,14,,100204,,"With the increasing urbanization, global generation of Municipal Solid Waste (MSW) is expected to increase to 3.4 billion tons by 2050. Annually, 1.9 billion tons of MSW is generated with each person contributing 218 kg of MSW to this projected grand total. In Kampala, the annual MSW collection exceeds 350,000 tons which is disposed at the city's landfill which has exceeded its capacity. This has side effects including environmental contamination, methane gas generation promoting global warming, and labour issues. No research has been conducted towards assessing the potential of energy recovery from the city's MSW by incineration. In this paper, the techno-economic assessment of energy recovery from MSW in Kampala city using incineration was done. Waste data was collected through sampling upon delivery at the landfill. Chemical composition of the waste was determined by proximate analysis and calculation of the elemental composition followed by determination of the calorific value. A MSW incineration plant was designed based on a mass burn incineration. The design parameters were determined using thermodynamic equations and Peng Robison's equations of state. Simulation was done using Aspen Plus and Aspen Hysys, for a plant combusting 220,000 tons per annum of MSW at a feed rate of 27 tons of MSW per hour. The economic analysis was done assuming that the project was a Public Private Partnership debt financed by 75 % with an interest rate of LIBOR plus 5 % margin over a term of 15 years. Results showed that the composition of the waste was largely organic with an 80% composition. The Lower Heating Value was 6.12 MJ/kg with a moisture content of 25%. The elemental composition was 43.47% Carbon, 5.52% Hydrogen, and 41% Oxygen with absence of Nitrogen and Sulfur. The ash content was reported at 6.65 %. From the simulations, the plant is capable of exporting 774 kWh of electricity per ton of MSW to the national grid, capable of powering 1,062 medium income households in Uganda. A capital investment of USD157 million with the sale of electricity and a gate fee as the sources of revenue for a project running for 25 years was considered. The resulting Net Present Value was USD 30 million with a project Internal Rate of Return of 12.6 % and a payback period of 6 years. Thus, the present study demonstrates the possibilities to increase the adoption and use of renewable and clean energy, prioritise energy efficiency, and biodiversity for a green and sustainable Kampala city. Moreover, the results provide immediate technical information for policy makers and potential investors in the development of waste to energy projects in Uganda.",Aspen Plus and Aspen Hysys | Incineration | Municipal solid waste | Simulation | Waste characterisation,18,1,publisherfullgold,Gold,,undefined,
106,2-s2.0-85126634444,10.1016/j.ijhydene.2022.02.180,S0360319922008187,,Analytical model for a techno-economic assessment of green hydrogen production in photovoltaic power station case study Salalah city-Oman,ar,Article,Zghaibeh M.,60105222;60071776;60060060,Prince Sattam Bin Abdulaziz University;Dhofar University;Ecole Nationale d'Ingenieurs de Monastir,Al Kharj;Salalah;Monastir,Saudi Arabia;Oman;Tunisia,6,"Zghaibeh, Manaf;Barhoumi, El Manaa;Okonkwo, Paul C.;Ben Belgacem, Ikram;Beitelmal, Wesam Hassan;Mansir, Ibrahim B.",23007291700;35766392000;56720223700;57205617086;57197727847;37011200100,60071776;60071776;60071776;60060060;60071776;60105222,2022-04-12 00:00:00,12 April 2022,International Journal of Hydrogen Energy,03603199,26991,,Journal,47,31,,14171-14179,"Hydrogen energy will play a credible role to reduce gas emissions in the transportation sector, the storage of energy, and other industrial applications. Moreover, the hydrogen produced from renewable energy sources allows to minimize greenhouse gas and increase the net profit of energy projects. This paper discusses the feasibility of the conversion of solar energy into hydrogen in a Photovoltaic Hydrogen Station (PVHS) in the south of Oman. Then, the sizing of different equipment and hydrogen production estimation in a 5 MWp PVHS is presented. The analysis of the investment cost (IC), the Net Profit (NP), and the Levelized Hydrogen Energy Cost (LHEC) are discussed to investigate the benefit of the project. The energy generated from the PV system and the produced hydrogen is calculated through an analytical model. The PVHS consists of 5 MWp PV panels connected to electrolyzers through maximum power point-controlled converters. The electrolyzers convert the electrical energy and the water into hydrogen. The hydrogen compressed and stored in special tanks can be used later in many industrial applications. The system produces about 90 910 kg of hydrogen per year with an IC of 5 301 760 €. The calculated LHEC is equal to 6.2 €/kg at an interest rate of 2%. The analysis has shown promising green hydrogen production projects in Oman.",Breakeven point | Hydrogen | Levelized cost | Net profit | Photovoltaic,36,0,,,,undefined,
