,eid,doi,pii,pubmed_id,title,subtype,subtypeDescription,creator,afid,affilname,affiliation_city,affiliation_country,author_count,author_names,author_ids,author_afids,coverDate,coverDisplayDate,publicationName,issn,source_id,eIssn,aggregationType,volume,issueIdentifier,article_number,pageRange,description,authkeywords,citedby_count,openaccess,freetoread,freetoreadLabel,fund_acr,fund_no,fund_sponsor
179,2-s2.0-85086770314,10.1016/j.renene.2020.05.155,S0960148120308600,,Optimisation of biomass-fired cogeneration plants using ORC technology,ar,Article,Świerzewski M.,60009081,Silesian University of Technology,Gliwice,Poland,2,"Świerzewski, Mateusz;Kalina, Jacek",57195757771;12763508600,60009081;60009081,2020-10-01 00:00:00,October 2020,Renewable Energy,09601481,27569,18790682,Journal,159,,,195-214,"In this paper, the problem of optimal sizing of biomass-fired ORC combined heat and power (CHP) unit for existing coal-fired district heating (DH) plant is discussed. The study examines the influence of boundary conditions on the optimal design characteristics of the ORC CHP system within heating plant backfitting project. The optimisation task is solved for given site-specific technical, economic, ecological and legal constraints. The proposed methodology for synthesis of new technological structure takes into account long-term operational experience and results of measurements of a given reference plant. Although the methodology is general, the solution presented in the paper is relevant for Polish DH sector. The analysis considers country specific system of financial incentives for renewable energy projects as well as participation in electricity balancing market and European Trading System (ETS). Thermal energy storage is considered as a solution providing flexibility of CHP system operation. Influence of different electricity, biomass, coal and EUA (European Emission Allowance) prices on optimal size and structure of the cogeneration system is examined. The analysis revealed that economic optima are relatively flat and the range of ORC unit size, for which the value of objective function is close to the optimum is quite wide. Although Net Present Value (NPV) and Internal Rate of Return (IRR) suggest slightly different size of the system, the recommended solutions are the ones with relatively long annual time of operation. The optimum size of ORC for a DH system of approximately 30 MW peak heating output is within the range of electric power of 1–2 MW. It was also found that although market prices and support instruments are nowadays different than at the time of commissioning of the reference plant, the size of the ORC unit is still close to the optimal value. Implementation of thermal energy storage (TES) in the form of hot water storage tank moves the optimal rated electric power of the ORC generator slightly towards higher values. On the other hand, only a small improvement of financial performance is gained by implementation of TES. Considerable improvement of economic performance has been reached after anticipated increase paths for electricity and EUA prices were introduced. In this case however, the recommended optimal size of the ORC CHP remained almost the same as in the case of constant prices.",Biomass | Cogeneration | Decarbonisation | District heating | Heat storage | ORC,23,0,,,,undefined,Politechnika Śląska
180,2-s2.0-85084075299,10.1016/j.erss.2020.101556,S2214629620301328,,SDGs in action: A novel framework for assessing energy projects against the sustainable development goals,ar,Article,Castor J.,60002014,The Royal Institute of Technology (KTH),Stockholm,Sweden,3,"Castor, Jennifer;Bacha, Kaylyn;Fuso Nerini, Francesco",57216614462;57216611164;56074827200,60002014;60002014;60002014,2020-10-01 00:00:00,October 2020,Energy Research and Social Science,22146296,21100325067,,Journal,68,,101556,,"Energy projects in pursuit of Sustainable Development Goal 7, which addresses affordable and clean energy, can have numerous synergies and trade-offs with all other SDGs and their targets. However, the identification of such interlinkages is both complicated and scattered in literature. To overcome this gap, this research presents the development and application of the Sustainable Development Goals Impact Assessment Framework for Energy Projects (SDGs-IAE) for qualitative assessment of SDG target synergies and trade-offs within the context of a given energy project. Two diverse case studies ‒ the Grand Ethiopian Renaissance Dam (GERD) and the Hinkley Point C Nuclear Power Station (HPC) ‒ are utilized to test the framework. Each case study highlights important SDG target interactions drawn out by this process. The GERD analysis shows the many synergies that result from energy access expansion while also bringing up trade-offs related to transboundary water rights and community relocation. In the case of the HPC, long-term ecosystem impacts of uranium mining and trade-offs related to future climate resilience and energy affordability are identified. The final resulting framework and corresponding excel-based tool can inform a dialog among stakeholders about the key areas of improvement related to the project´s social, environmental and economic sustainability.",,65,1,publisherhybridgold,Hybrid Gold,WBG,65–67,World Bank Group
181,2-s2.0-85091880204,10.3390/en13184833,,,Cost of equity of coal-fired power generation projects in poland: Its importance for the management of decision-making process,ar,Article,Saługa P.W.,60107816;60009913;60009081,"WSB University, Dabrowa Gornicza;Częstochowa University Of Technology;Silesian University of Technology",Dabrowa Gornicza;Czestochowa;Gliwice,Poland;Poland;Poland,4,"Saługa, Piotr W.;Szczepańska-Woszczyna, Katarzyna;Miśkiewicz, Radosław;Chład, Mateusz",6506800622;56712900000;57204275166;57210430283,60107816;60107816;60009081;60009913,2020-09-01 00:00:00,September 2020,Energies,,62932,19961073,Journal,13,18,4833,,"Our knowledge of discount rates plays an important role both in the discounted cash flow decision-making process and in the later phases of a project’s lifetime. It is useful than both for management and cash-flow monitoring purposes at operating stages. Investors putting money into power generation projects expect an appropriate rate of return to compensate them for a minimum acceptable real return available in the market (risk-free rate of interest) and the project’s specific risk. Due to its essential nature in the financial and economic evaluation of projects (it is the only parameter that reflects the risk), it is reasonable to assume that investors would also be interested in constituent components of that indicator. The discount rate is one parameter in the discounted cash flow analysis that takes into account the risk of a venture. Further, the previous research in this area has focused mainly on the dimension of this variable, and the structure of this parameter has not been dealt with any other studies. The proposed idea of this study met the expectations of the industry—it aimed to present a typical project implemented in the energy industry, a relatively simple methodology that allowed estimating the components within the cost of equity capital of the enterprise. In the power generation sector, one can find various types of discount rates—assessed for multiple technologies, at different development stages, and expressed differently. Owing to the know-how and decades-long experience, coal-fired power projects’ remarks may be a good benchmark for alternative low carbon technologies. That is why, in this work, a discount rate for valuing investment in new coal-fired power projects was evaluated. This assessment was made on the “bare-bones” assumption, meaning evaluations at 100% equity, after-tax, in constant (real) currency units. The analysis of the discount rate structure was performed by applying the procedure of the classical sensitivity analysis having the accuracy of key input parameters. Finally, the risk factors within the risk-adjusted discount rate were calculated. The obtained results showed the importance of individual risk factors within the risk-adjusted discount rate used in coal energy projects, which would enable a more pragmatic approach to controlling this parameter by decision-makers and understanding the risk.",Cash-flows | Coal-fired power generation | Cost of capital | Discount rate | Economic evaluation | Investments,110,1,repositoryvor,Green,,undefined,
182,2-s2.0-85091579271,10.3390/SU12187432,,,"Sustainability, sociocultural challenges, and new power of capitalism for renewable energy megaprojects in an indigenous Mayan Community of Mexico",ar,Article,El Mekaoui A.,60032442;60000409,Universidad Nacional Autónoma de México;Universidad Autónoma de Yucatán,Mexico;Merida,Mexico;Mexico,4,"El Mekaoui, Amina;Tariq, Rasikh;Ramírez, Othón Baños;Méndez-Monroy, P. E.",57219173906;57200243861;57219176400;58225098600,60000409;60000409;60000409;60032442,2020-09-01 00:00:00,September 2020,Sustainability (Switzerland),,21100240100,20711050,Journal,12,18,7432,,"Sustainable development is an integrated blend of energetic, economic, social, environmental, and governmental actors, making it one of the most challenging and subjective aims of the United Nations. A sustainability project that does not consider any of these parameters can generate resistance among different actors of society. In this work, we have demonstrated that the traditional definition of sustainability encompassing economic development, environmental protection, and social justice does not adequately cover large-scale renewable energy projects. We have presented an illuminating case study of solar development in the Yucatan state of Mexico to show that the traditional three-legged stool of sustainable development fails to accommodate local power relations and their role in energy decision-making. This point is made through a substantive and illuminating ethnography of a solar project in the community of San José Tipceh, which involves the importance of energy democracy and understanding power relations in any assessment of sustainable development. These power relations are an important component of sustainable development, and all megaprojects, especially renewable energy projects, require special attention in the governance processes. Through an analysis of an example of implementation of a mega solar project, we argue that the methodology through which the power is exercised is an exercise of great importance because it leads us to a scientific discussion that structures an international reflection on sustainability. The case study consists of mixed methods, including several techniques to deepen the analysis of sociocultural aspects, and tries to present the limits and show the weakness of the sustainability perspective in such megaprojects. It is concluded that environmental justice as a basic element of the new era of renewable energies is limited and can generate social injustices. In the same way, this work shows how power is exercised in the implementation of energy projects and in the absence of equitable comprehensive governance that does not consider the local sociocultural contexts of the communities, resulting in the generation of new powers and permanent conflicts. At the end of this work, a framework to empower local sociocultural contexts for an equitable energy transition is recommended.",Energetic capitalism | Energy democracy | Indigenous community | Renewable energy megaprojects | Social resistance | Sustainable development,21,1,repositoryvor,Green,CONACYT,IA102620,Consejo Nacional de Ciencia y Tecnología
183,2-s2.0-85086069585,10.1016/j.esd.2020.05.002,S0973082620302398,,Modern energy consumption in Indonesia: Assessment for accessibility and affordability,ar,Article,Hartono D.,60196805;60069377;124538975,"Fakultas Ekonomi dan Bisnis, Universitas Indonesia;Universitas Indonesia;Research Cluster on Energy Modeling and Regional Economic Analysis",Depok;Depok;Depok,Indonesia;Indonesia;Indonesia,4,"Hartono, Djoni;Hastuti, Sasmita Hastri;Balya, Audhi Ahmad;Pramono, Wahyu",23008737100;57217019650;57217078661;58488995600,60196805-124538975;124538975;124538975;60069377,2020-08-01 00:00:00,August 2020,Energy for Sustainable Development,09730826,17600155126,23524669,Journal,57,,,57-68,"The Indonesian Government, in the last decade, attempted to increase modern energy consumption through the implementation of the Liquid Petroleum Gas (LPG) conversion program and the construction of numerous power generators. The attempt hoped to increase access to modern energy. This study investigates the Government modern energy projects by assessing both the accessibility and affordability of modern energy consumption in urban-rural areas and across different income level households. This study measured the changes in energy access in different household categories as well as the energy burden of each household category using descriptive statistics. The present study confirmed the roles of access and income in energy spending using multiple regression analysis. The result showed that household access to modern energy significantly increased in all household categories. However, access to rural households and low-income households still needed improvement. Besides, there was no proof of energy poverty in low-income households. The results also revealed that modern energy access, income, and head of household education were the major determinants of energy spending, especially for low-income household and rural areas. Hence, if Government wants to improve energy consumption, households are willing to consume modern energy if the supply is available. However, the education and financial ability will also be main consideration in determining energy consumption level.",Energy consumption | Energy cost burden | Energy policy | Modern energy,18,0,,,UI,undefined,Universitas Indonesia
186,2-s2.0-85086119622,10.1016/j.spc.2020.04.010,S235255092030018X,,Economic and environmental assessment of landfill gas electricity generation in urban districts of Beijing municipality,ar,Article,Cudjoe D.,60016835,Beijing Institute of Technology,Beijing,China,2,"Cudjoe, Dan;Han, Myat Su",57215588332;57217369663,60016835;60016835,2020-07-01 00:00:00,July 2020,Sustainable Production and Consumption,,21100416081,23525509,Journal,23,,,128-137,"The present study assesses the electricity generation potential of methane from municipal solid waste through landfill gas to energy technology in 16 districts of Beijing municipality. Municipal solid waste generation potential and methane generation potential from landfills of each of the districts were estimated from 2019 to 2038. Economic viability analysis of landfill gas to energy project based on Net Present Value, Levelized Cost of Energy, and Payback Period was conducted. Besides, environmental impact analysis based on greenhouse gas emissions potential was evaluated. Key results indicate that the generation potential of municipal solid waste during the project period is 55,000 to 2,120,000 tons/year. Chaoyang district has the highest municipal solid waste generation potential, while lower municipal solid waste generation potential was observed in Mentougou district. It is also found that Chaoyang district had the highest electricity generation potential of 8,400,000 to 218,300,000 kWh/year. Findings of the economic feasibility analysis show that landfill gas to energy project is viable in all the districts. However, the project is highly viable in Chaoyang district with more positive net present value ($181,100,000), shorter payback period (1.3years), and lower levelized cost of energy ($0.0613/kWh). Greenhouse gas emission potential of landfill gas without energy recovery was the highest in all the districts. It was realized that landfill gas with energy recovery could reduce greenhouse gas emissions by 72.3% in all the districts. This paper will provide scientific guidance for investment in landfill gas to energy projects in Beijing municipality and other municipalities of China.",Economy | Electricity | Environment | Landfill gas | Municipal solid waste | Technology,22,0,,,,undefined,
187,2-s2.0-85081284788,10.1016/j.fuproc.2020.106381,S0378382020301521,,Electricity generation using biogas from organic fraction of municipal solid waste generated in provinces of China: Techno-economic and environmental impact analysis,ar,Article,Cudjoe D.,60016835,Beijing Institute of Technology,Beijing,China,3,"Cudjoe, Dan;Han, Myat Su;Nandiwardhana, Aditya P.",57215588332;57217369663;57215587211,60016835;60016835;60016835,2020-06-15 00:00:00,15 June 2020,Fuel Processing Technology,03783820,16315,,Journal,203,,106381,,"This study assessed the electricity generation potential of biogas from organic fraction of municipal solid waste collected for disposal from 2004 to 2018 in 31 provinces of China using landfill gas to energy (LFGTE) and anaerobic digestion (AD) technologies. Economic feasibility assessment of the technologies was carried out using Net Present Value, and Levelized Cost of Energy methods. In addition, environmental impact of waste management options based on global warming potential was assessed under three scenarios. Key findings showed that electricity generation potential of anaerobic digestion technology was higher in all the provinces. Economically, the results showed that both projects are feasible in all the 31 provinces. However, anaerobic digestion project proved to be highly feasible, with more positive net present value, and lower levelized cost of energy. Sensitivity analysis showed that both projects are infeasible with a discount rate beyond 20%. The results also showed that landfill gas without energy recovery has high global warming potential. It was realized that on the average landfill gas to energy technology could reduce global warming potential by 71.5%, while anaerobic digestion technology could reduce global warming potential by 92.7%. This study will offer scientific guidance for investment in anaerobic digestion and landfill gas to energy projects in China and other countries.",Anaerobic digestion technology | Biogas | Electricity generation potential | Global warming potential | Landfill gas to energy technology | Organic fraction of municipal solid waste,64,0,,,,undefined,
188,2-s2.0-85085842149,10.3390/en13112764,,,Economic assessment of distributed generation technologies: A feasibility study and comparison with the literature,ar,Article,Al-Sumaiti A.S.,60156602;60104134;60070610;60025778;60014171,"College of Engineering;Khalifa University of Science and Technology;University of Lahore;University of Michigan, Ann Arbor;University of Waterloo",Tampa;Abu Dhabi;Lahore;Ann Arbor;Waterloo,United States;United Arab Emirates;Pakistan;United States;Canada,6,"Al-Sumaiti, Ameena Saad;Kavousi-Fard, Abdollah;Salama, Magdy;Pourbehzadi, Motahareh;Reddy, Srikanth;Rasheed, Muhammad Babar",56027880200;55177044900;56623995300;57205744036;57191165069;56564996000,60104134;60025778;60014171;60156602;60104134;60070610,2020-06-01 00:00:00,June 2020,Energies,,62932,19961073,Journal,13,11,2764,,"With the negative climate impact of fossil fuel power generation and the requirement of global policy to shift towards a green mix of energy production, the investment in renewable energy is an opportunity in developing countries. However, poor economy associated with limited income, funds availability, and regulations governing project funding and development are key factors that challenge investors in the energy sector. Given the various power generation resources, including renewables, it is necessary to evaluate the possible power generation investment options from an economic perspective. To realize this objective, solar PV, wind and diesel power generations are economically compared, considering the incremental rate of return and incremental benefit to cost ratio techniques. The alternative investment options of distributed generation technologies are evaluated for Maharashtra, India under different depreciation methods, and the effect of the latter on selecting the best investment candidate is investigated. The paper also conducts sensitivity analysis to examine the impact of capital cost, operation and maintenance cost, and fuel cost variations on the selection decision considering a comparison of the different general projects' cash flow structures discussed in the literature. The economic aspects of selecting a project among possible alternatives for an investment in the power sector are analyzed, and the presented review provides comprehensive comparisons with respect to the literature approaches. The results reveal that, in the benchmark case study, the PV project is rejected and disregarded from further comparisons with other candidate projects since its equity internal rate of return (10.25%) is less than the minimum accepted rate of return, leaving the selection between wind and diesel energy projects. The study reveals that the incremental rates of return under such a comparison are 37.88%, 45.94% and 37.50% when MACRS, declining balance and straight line depreciations techniques are applied, respectively. Thus, the wind energy project is the favored option in this case. For the economic assessment of other case studies, the application of both sensitivity analysis on the capital cost and operation and maintenance cost and literature approaches to structure the projects reveal that wind energy for Maharashtra, India is a more attractive and feasible option compared to other distribution generation projects, while diesel is only considered to be a good option when its fuel cost is reduced by 5%. Finally, the paper highlights policy implications that can influence the decision to move towards investment in distributed generation technologies as a future research direction.",Benefit to cost ratio | Depreciation methods | Distributed generation technologies | Incremental rate of return analysis | Modified accelerated cost recovery system | Policy implications,22,1,repositoryam,Green,KU,FSU-2018-25,"Khalifa University of Science, Technology and Research"
191,2-s2.0-85079355285,10.1016/j.foreco.2020.117938,S0378112719319577,,Forest quality-based assessment of the Returning Farmland to Forest Program at the community level in SW China,ar,Article,Li W.,60028009;60018910,Yunnan University;Kunming Institute of Botany,Kunming;Kunming,China;China,3,"Li, Wenqing;Chen, Jiahui;Zhang, Zhiming",59103285200;24337480800;57094265300,60018910-60028009;60018910;60028009,2020-04-01 00:00:00,1 April 2020,Forest Ecology and Management,03781127,25720,,Journal,461,,117938,,"The Returning Farmland to Forest Program (RFFP) has played an important role in controlling soil erosion, increasing vegetation cover, and transforming rural livelihoods in China. The program may promote vegetation restoration, increase the proportion of households engaged in off-farm labor, and improve forest management, and thus contribute to enhanced forest quality. However, studies of RFFP's impact on forest quality at the community level remain inadequate. The purpose of this study was to test the following hypothesis: that RFFP implementation would lead to a significant difference in forest quality between communities with RFFP implementation versus those without. Twelve communities in Southwest China were selected as subjects, all being rich in biological and cultural diversity but have high poverty rates. We conducted a linked analysis combining forest quality data with socio-economic data to examine the effectiveness of RFFP at the community level. Forest community data were obtained through field surveys in July–August 2014, and socio-economic data was collected using a questionnaire survey. A forest quality index system was constructed using factor analysis, and the difference in forest quality between village that did and did not implement RFFP were compared. Key environmental and socio-economic variables affecting forest quality were identified by a constrained ordination method. Our results show that neither the structure, diversity, biomass nor soil fertility of the forest communities were not differed significantly between the village communities with and without RFFP. Elevation, fuelwood harvesting and solar energy projects contributed markedly to forest quality, suggesting that the RFFP probably did not directly drive the existing differences in forest quality among the 12 communities. Both natural and socio-economic factors affect forest quality. Considering current rural livelihood needs and the goals of expanding forest cover and improving forest quality, ensuring that land users have a meaningful voice in decisions about forest regeneration and establishing compensation mechanisms for forest management may be key directions to pursue in the future for sustainable development.",Environmental condition | Forest quality | Returning Farmland to Forest Program | Socio-economic survey,41,0,,,NSFC,2019HB2096001006,National Natural Science Foundation of China
